{
  "contract": "grants-gov-xml-profile/v1",
  "formId": "example",
  "xsd": {
    "uri": "https://example.gov/forms/Example-V1.0.xsd",
    "sha256": "aaaaaaaaaaaaaaaaaaaaaaaaaaaaaaaaaaaaaaaaaaaaaaaaaaaaaaaaaaaaaaaa"
  },
  "namespaces": {
    "default": "https://example.gov/forms/Example-V1.0",
    "att": "https://example.gov/system/Attachments-V1.0"
  },
  "root": {
    "element": "Example",
    "namespacePrefix": "Example",
    "attributes": { "FormVersion": "1.0" }
  },
  "attachment": {
    "fields": {
      "fileName": { "element": "FileName", "namespace": "att" },
      "mimeType": { "element": "MimeType", "namespace": "att" },
      "fileLocation": { "element": "FileLocation", "namespace": "att" },
      "hashValue": { "element": "HashValue", "namespace": "att" }
    }
  },
  "mapping": {
    "fields": {
      "title": {
        "element": "Title",
        "kind": "value",
        "source": "/title",
        "valueMap": { "draft": "D", "final": "F" }
      },
      "metadata": {
        "element": "Metadata",
        "kind": "group",
        "flatten": true,
        "fields": {
          "version": { "element": "Version", "kind": "value", "constant": "1.0" }
        }
      },
      "files": {
        "element": "Files",
        "kind": "array",
        "attributes": {
          "status": { "source": "/title", "valueMap": { "draft": "D", "final": "F" } },
          "version": { "constant": "1.0" }
        },
        "items": {
          "fields": {
            "file": {
              "element": "File",
              "kind": "attachment",
              "container": { "element": "FileContainer", "namespace": "default" }
            }
          }
        }
      }
    }
  }
}
