{
  "contract": "grants-gov-xml-profile/v1",
  "formId": "project-abstract-summary",
  "xsd": {
    "uri": "https://apply07.grants.gov/apply/forms/schemas/Project_AbstractSummary_2_0-V2.0.xsd",
    "sha256": "3022f177a7f0ebb9a1888e9b8a4a644ed2ba7857a775d2d05642a9fbd1cc008f"
  },
  "namespaces": {
    "default": "http://apply.grants.gov/forms/Project_AbstractSummary_2_0-V2.0",
    "Project_AbstractSummary_2_0": "http://apply.grants.gov/forms/Project_AbstractSummary_2_0-V2.0",
    "globLib": "http://apply.grants.gov/system/GlobalLibrary-V2.0"
  },
  "root": {
    "element": "Project_AbstractSummary_2_0",
    "namespacePrefix": "Project_AbstractSummary_2_0",
    "attributes": { "FormVersion": "2.0" }
  },
  "mapping": {
    "fields": {
      "fundingOpportunityNumber": {
        "element": "FundingOpportunityNumber",
        "kind": "value",
        "namespace": "default"
      },
      "assistanceListingNumber": {
        "element": "CFDANumber",
        "kind": "value",
        "namespace": "default"
      },
      "applicantName": {
        "element": "OrganizationName",
        "kind": "value",
        "namespace": "default"
      },
      "projectTitle": {
        "element": "ProjectTitle",
        "kind": "value",
        "namespace": "default"
      },
      "projectAbstract": {
        "element": "ProjectAbstract",
        "kind": "value",
        "namespace": "default"
      }
    }
  },
  "evidence": {
    "status": "source-bound-unreviewed",
    "repository": "https://github.com/mikec-ai/grants-question-crosswalk",
    "revision": "dfe9e47ffd6a25c967b8ed38703480ccdc15a8ef",
    "artifact": "artifacts/proof/grantsgov-ProjectAbstractSummary.jsonl.manifest.json"
  }
}
